{
  "url": "https://sample-ginger-co.example/products/gin-gins-original/",
  "type": "product",
  "status": 200,
  "meta": {
    "title": "pdp-gingins | Sample Ginger Co",
    "description": "Ginger candy and natural nausea relief.",
    "og": {
      "og:title": "Sample Ginger Co"
    },
    "viewport": "width=device-width, initial-scale=1",
    "jsonld": []
  },
  "elements": [],
  "cro_signals": {
    "price": {
      "present": false
    },
    "add_to_cart": {
      "present": false
    },
    "reviews": {
      "present": true,
      "value": "86 reviews"
    },
    "trust_badges": {
      "present": true,
      "items": [
        "America's #1 selling ginger candy",
        "award-winning"
      ]
    },
    "search": {
      "present": true
    },
    "promo_bar": {
      "present": true
    },
    "primary_cta": {
      "present": true,
      "text": "Buy online or find it in store"
    }
  },
  "text_blocks": [
    {
      "role": "h1",
      "text": "pdp-gingins"
    }
  ],
  "content": "GIN GINS Original Ginger Chews — 10% fresh ginger, individually wrapped. Great for nausea, motion sickness and morning sickness. 86 reviews.",
  "screenshots": [
    "pdp-gingins/screenshots/pdp-gingins-fullpage.png",
    "pdp-gingins/screenshots/pdp-gingins-hero.png"
  ],
  "network": {
    "nav_timing_ms": 1800,
    "requests": 70,
    "transfer_kb": 4200,
    "redirects": [
      {
        "from": "http://sample-ginger-co.example/products/gin-gins-original/",
        "to": "https://sample-ginger-co.example/products/gin-gins-original/",
        "status": 301
      }
    ],
    "security_headers": {
      "strict-transport-security": "max-age=31536000",
      "content-security-policy": "default-src 'self'"
    },
    "responses": [
      {
        "url": "https://sample-ginger-co.example/products/gin-gins-original/",
        "status": 200
      }
    ]
  },
  "console_errors": []
}